id,text,screen_name,created_at,retweet_count,favorite_count,friends_count,followers_count,lang,country
1248306005508677632,#COVID19 has us living one day at a time... #undiaalavez @tigresdelnorte,VictorRTafoya,Thu Apr 09 17:45:18 +0000 2020,0,0,7524,2320,en,United States
1248306076698570753,Today Big Good News DNH DD for #COVID19 50 samples tested and all 50 samples Nagative #thankyou @PMOIndia…,krunaldnh,Thu Apr 09 17:45:35 +0000 2020,0,0,750,498,en,India
1248313332660133891,"Pres Cyril Ramaphosa to SAns: ""You have respected the lockdown and largely observed its regulations."" #lockdown #coronavirus",ManqobaMchunu,Thu Apr 09 18:14:25 +0000 2020,0,0,920,20964,en,South Africa
1248313382484226049,TRAVEL FROM THE SOFA 🤗 @chm_itu #cevherhazırlamamuhendisliği #COVID19 #EvdeKal #HayatEverSığar #EvdeHayatVar,chm_itu,Thu Apr 09 18:14:37 +0000 2020,0,0,1471,1028,en,Turkey
1248313387127320576,"Getting closer! The genetic history of the coronavirus was mapped from December 24 to March 4, revealing three dist…",dubchanter,Thu Apr 09 18:14:38 +0000 2020,0,0,316,158,en,United States
1247399096018665473,#COVID19 #MiamiBeach Please see screen shots. #Masks #coronavirus #SocialDistancing @MiamiBeachNews @MiamiBeachPD…,familiamiami,Tue Apr 07 05:41:34 +0000 2020,0,0,21,44,en,United States
